question,type,columns_used,column_types,sample_answer,dataset,float_answer,answer_coords
What's the highest number of occupants recorded in an incident? Use the Onboard_Total columns to give a numerical answer. Use the Onboard_Total columns to give a numerical answer. Use the Onboard_Total columns to give a numerical answer. Use the Onboard_Total columns to give a numerical answer. Use the Onboard_Total columns to give a numerical answer. Use the Onboard_Total columns to give a numerical answer.,number,['Onboard_Total'],['category'],86,019_Aircraft.csv,86.0,"[(16, 3)]"
How many incidents resulted in non-zero fatalities? Use the Fatalities columns to give a numerical answer. Use the Fatalities columns to give a numerical answer. Use the Fatalities columns to give a numerical answer. Use the Fatalities columns to give a numerical answer. Use the Fatalities columns to give a numerical answer. Use the Fatalities columns to give a numerical answer.,number,['Fatalities'],['number[uint16]'],10,019_Aircraft.csv,10.0,"[(0, 8), (1, 8), (9, 8), (10, 8), (11, 8), (12, 8), (17, 8), (18, 8), (19, 8)]"
Which aircraft model was involved in the most incidents? Use the Aircaft_Model columns to give a categorical answer. Use the Aircaft_Model columns to give a categorical answer. Use the Aircaft_Model columns to give a categorical answer. Use the Aircaft_Model columns to give a categorical answer. Use the Aircaft_Model columns to give a categorical answer. Use the Aircaft_Model columns to give a categorical answer.,category,['Aircaft_Model'],['category'],Antonov An-2V,019_Aircraft.csv,,"[(0, 4)]"
What was the cause of the incident that resulted in the most fatalities? Use the Incident_Cause(es) and  Fatalities columns to give a categorical answer. Use the Incident_Cause(es) and  Fatalities columns to give a categorical answer. Use the Incident_Cause(es) and  Fatalities columns to give a categorical answer. Use the Incident_Cause(es) and  Fatalities columns to give a categorical answer. Use the Incident_Cause(es) and  Fatalities columns to give a categorical answer. Use the Incident_Cause(es) and  Fatalities columns to give a categorical answer.,category,"['Incident_Cause(es)', 'Fatalities']","['category', 'number[uint16]']","Result - Loss of control, Security - Sabotage (bomb)",019_Aircraft.csv,,"[(9, 11)]"
What is the most common phase of aircraft during incidents? Use the Aircraft_Phase columns to give a categorical answer. Use the Aircraft_Phase columns to give a categorical answer. Use the Aircraft_Phase columns to give a categorical answer. Use the Aircraft_Phase columns to give a categorical answer. Use the Aircraft_Phase columns to give a categorical answer. Use the Aircraft_Phase columns to give a categorical answer.,category,['Aircraft_Phase'],['category'],Landing (LDG),019_Aircraft.csv,,"[(3, 6)]"
What is the location of the incident with the highest number of onboard occupants? Use the Incident_Location and  Onboard_Total columns to give a categorical answer. Use the Incident_Location and  Onboard_Total columns to give a categorical answer. Use the Incident_Location and  Onboard_Total columns to give a categorical answer. Use the Incident_Location and  Onboard_Total columns to give a categorical answer. Use the Incident_Location and  Onboard_Total columns to give a categorical answer. Use the Incident_Location and  Onboard_Total columns to give a categorical answer.,category,"['Incident_Location', 'Onboard_Total']","['category', 'category']",Sioux Falls ...,019_Aircraft.csv,,"[(16, 0)]"
